Category,Problem List Item,BraveEve's Conversational Question,Verbatim,Yes,No
Introduction,,"Hello [Name]. I would like to ask you a few simple questions about how you have been feeling lately. Sometimes cancer and treatment can affect the body, mind, emotions, daily life, relationships, or even faith. We call these feelings distress. There are no right or wrong answers. Just share whatever feels true for you.",,,
Distress Level,,"Thinking about the past week, including today, how much distress have you been feeling? Please choose a number from 0 to 10. 0 means no distress, 5 means moderate distress, and 10 means extreme distress.","""You feel everything is distress, everything is unorganized, nothing is in place, and I don't know what I am doing."" ","Thank you for sharing that, [Name]. Now I’ll ask a few questions to understand what may be causing this distress.",
Physical,Pain,"We all get body pain sometimes. [Name], is your body feeling any pain or soreness lately?","A person undergoing chemotherapy said, ""I would have body pain and would be in bed most of the time."" ","Thank you for telling me. It is hard when the body hurts, and you are being so incredibly strong just by getting through today.",That's really good to hear. I'm happy your body feels more comfortable.
Physical,Pain,"Dealing with a sick body is not easy, [Name]. Lately, has any part of your body been hurting, paining, or feeling very sore?","A person undergoing chemotherapy said, ""I would have body pain and would be in bed most of the time."" ","Thank you for telling me. It is hard when the body hurts, and you are being so incredibly strong just by getting through today.",That is wonderful to hear! I am so happy that your body is feeling comfortable and relaxed today.
Physical,Pain,"Sometimes our body feels heavy and hurts when we are unwell. [Name], have you had any pain or body aches recently?","A person undergoing chemotherapy said, ""I would have body pain and would be in bed most of the time."" ","Dealing with physical pain takes a lot of mental strength, and you are doing an amazing job handling things one moment at a time.",That is very good news! It is a big relief when the body feels light and free of any aches.
Physical,Pain,"[Name], I want to check on how your body is feeling. In these past few days, have you had any discomfort or pain anywhere?","A person undergoing chemotherapy said, ""I would have body pain and would be in bed most of the time."" ","Please be very gentle with yourself today. When the body is aching, resting quietly is the best thing you can do for yourself.",I am so glad to know that! Having a pain-free day brings so much peace to the mind and body.
Physical,Pain,"[Name], have you noticed any body pain or soreness this week?","A person undergoing chemotherapy said, ""I would have body pain and would be in bed most of the time."" ","Thank you for sharing this with me. Please take a comfortable position, breathe easy, and let your body rest as much as possible.",That brings a big smile to my face. It is great that your body is feeling so comfortable right now.
Physical,Pain,"Sometimes being sick makes our muscles ache, [Name]. Has your body been hurting at all recently?","A person undergoing chemotherapy said, ""I would have body pain and would be in bed most of the time."" ","Please be very soft on yourself today. When your muscles hurt, lying down quietly is the best medicine for you.",I am so glad to know that. Having a day without any pain brings so much peace to your mind.
Physical,Pain,"[Name], I want to make sure you are feeling okay. Have you had any pain or aches in your body this week?","A person undergoing chemotherapy said, ""I would have body pain and would be in bed most of the time."" ","Thank you for telling me this. Please sit in a comfortable way, take slow breaths, and let your body rest.",That brings a big smile to my face. It is wonderful that your body feels so relaxed right now.
Physical,Pain,"When we are not well, our body can feel very sore, [Name]. Has any part of your body been hurting lately?","A person undergoing chemotherapy said, ""I would have body pain and would be in bed most of the time."" ","Thank you for being so honest with me. When you are hurting, resting quietly is exactly what you need.",That is very good to hear. Staying free from body pain is a great blessing for your health today.
Physical,Pain,"[Name], let us talk about how your body feels today. Have you noticed any aches or pain recently?","A person undergoing chemotherapy said, ""I would have body pain and would be in bed most of the time."" ","It takes a lot of mental strength to face physical pain, and you are doing an amazing job today.",That is fantastic news! I am so happy that your body is feeling so comfortable and easy right now.
Physical,Pain,"[Name], our muscles can feel heavy and achy when we are sick. Have you had any body pain these days?","A person undergoing chemotherapy said, ""I would have body pain and would be in bed most of the time."" ",Thank you for sharing this with me. Lying down in a cozy spot and resting is the best thing for you now.,That brings a lot of relief. It is great that your body is not experiencing any discomfort today.
Physical,Pain,"[Name], it is not easy when your body feels weak and sore. Are you having any aches or pain right now?","A person undergoing chemotherapy said, ""I would have body pain and would be in bed most of the time."" ",Thank you for letting me know. Please take things very easy today and let your aching body rest well.,That brings a lot of joy to my heart. It is fantastic that your body feels so comfortable.
Physical,Pain,"When our body is fighting a sickness, it can hurt, [Name]. Have you noticed any body pain this week?","A person undergoing chemotherapy said, ""I would have body pain and would be in bed most of the time."" ","Dealing with physical pain is hard, but you are doing a beautiful job handling it one hour at a time.",That is a great sign. It is wonderful that your body is feeling completely fine and free of ache.
Physical,Pain,"[Name], I want to know how your body is doing. Is any part of your body aching or hurting lately?","A person undergoing chemotherapy said, ""I would have body pain and would be in bed most of the time."" ","Please do not take any stress, [Name]. When the body is hurting, resting quietly is the most helpful thing.",I am so happy for you. Having a comfortable and relaxed body brings so much peace to your day.
Physical,Pain,"[Name], our bodies need a lot of care when they feel sore. Are you dealing with any body pain these days?","A person undergoing chemotherapy said, ""I would have body pain and would be in bed most of the time."" ","I hear you, [Name]. It is completely okay to feel down when your body hurts. Just take it one step at a time.",That brings a big smile to my face. I am so glad your body is feeling completely comfortable today.
Physical,Pain,"[Name], let us check on your physical comfort today. Has your body been hurting or feeling very sore lately?","A person undergoing chemotherapy said, ""I would have body pain and would be in bed most of the time."" ","It is hard when you have body ache, but you are showing so much patience by getting through today.",That is fantastic! Hearing that your body feels comfortable and relaxed makes me very happy.
Physical,Sleep,Have you been staying awake a lot at night or finding it hard to sleep peacefully?,"A person getting cancer treatment said she felt sudden heat and sweating, which made it hard for her to sleep. She said, ""I wouldn’t get sleep due to hot flushes."" ","I understand [Name]. Not sleeping well makes the whole day feel very heavy, so please do not force yourself to do too much today.",That is wonderful! A good night's rest gives so much energy for the morning.
Physical,Sleep,"Getting good rest helps the body heal, [Name]. This past week, has it been difficult for you to fall asleep or sleep properly through the night?","A person getting cancer treatment said she felt sudden heat and sweating, which made it hard for her to sleep. She said, ""I wouldn’t get sleep due to hot flushes."" ","I understand, [Name]. Not sleeping well makes the whole day feel very heavy, so please do not force yourself to do too much today.",That is wonderful! A good night's rest gives so much energy for the morning.
Physical,Sleep,"[Name], how has your rest been at night? Have you been waking up a lot without getting proper sleep?","A person getting cancer treatment said she felt sudden heat and sweating, which made it hard for her to sleep. She said, ""I wouldn’t get sleep due to hot flushes."" ",Please don't take any tension if sleep is running away right now. Just lie down comfortably and let your mind drift gently without any hurry.,That is excellent to hear. Sleeping soundly is the best way for your body to recover its natural strength.
Physical,Sleep,"[Name], did you find it hard to get a good night's sleep this week?","A person getting cancer treatment said she felt sudden heat and sweating, which made it hard for her to sleep. She said, ""I wouldn’t get sleep due to hot flushes."" ","It can be quite tiring when sleep is broken at night. On days like this, it is completely okay to take small naps during the daytime.","I am so happy for you, [Name]. Waking up feeling refreshed is a very beautiful way to start the day."
Physical,Sleep,"[Name], have you been staying awake for a long time in the night or not able to sleep?","A person getting cancer treatment said she felt sudden heat and sweating, which made it hard for her to sleep. She said, ""I wouldn’t get sleep due to hot flushes."" ","Thank you for telling me. A heavy night makes the morning feel slow, so please take things very easy and rest whenever you can today.",That is great news! Having a peaceful and undisturbed sleep is a big blessing for your health.
Physical,Sleep,"[Name], did you find it difficult to fall asleep quickly or stay asleep through the night this week?","A person getting cancer treatment said she felt sudden heat and sweating, which made it hard for her to sleep. She said, ""I wouldn’t get sleep due to hot flushes."" ","I understand, [Name]. Not getting proper sleep makes the next day feel very heavy, so please rest today.",That is wonderful! A good night's sleep gives you so much fresh energy for the morning.
Physical,Sleep,"Is it hard for you to close your eyes and sleep peacefully when you lie down at night, [Name]?","A person getting cancer treatment said she felt sudden heat and sweating, which made it hard for her to sleep. She said, ""I wouldn’t get sleep due to hot flushes."" ",Please do not worry if sleep is not coming easily right now. Just lie down and relax your mind gently.,That is very good news. Sleeping soundly helps your body recover its natural strength quickly.
Physical,Sleep,"Have you been staying awake for many hours during the dark night lately, [Name]?","A person getting cancer treatment said she felt sudden heat and sweating, which made it hard for her to sleep. She said, ""I wouldn’t get sleep due to hot flushes."" ",Thank you for sharing. Please do not feel any tension about your sleep. Just close your eyes and rest quietly.,That is fantastic! I am so glad that you slept so soundly and beautifully through the night.
Physical,Sleep,"[Name], how has your rest been at night? Have you been waking up a lot without getting proper sleep?","A person getting cancer treatment said she felt sudden heat and sweating, which made it hard for her to sleep. She said, ""I wouldn’t get sleep due to hot flushes."" ","It is very hard when you cannot sleep properly. On days like this, please give your body extra rest.",That is excellent to hear. Feeling completely refreshed in the morning is a very good sign.
Physical,Sleep,"Did you find it hard to get a good sleep recently, [Name]?","A person getting cancer treatment said she felt sudden heat and sweating, which made it hard for her to sleep. She said, ""I wouldn’t get sleep due to hot flushes."" ","I understand completely, [Name]. A heavy night means you need a slow day, so please rest whenever you can.",That brings a big smile to my face. Having a quiet and undisturbed sleep is wonderful for you.
Physical,Sleep,"[Name], have your sleep hours been very less or disturbed during this past week?","A person getting cancer treatment said she felt sudden heat and sweating, which made it hard for her to sleep. She said, ""I wouldn’t get sleep due to hot flushes."" ",Thank you for letting me know. Please do not force yourself to stay active today; just relax in bed.,That is wonderful news! It is great that your body got a very peaceful and deep rest last night.
Physical,Sleep,"[Name], did you feel that you could not sleep properly even for a few hours this week?","A person getting cancer treatment said she felt sudden heat and sweating, which made it hard for her to sleep. She said, ""I wouldn’t get sleep due to hot flushes."" ",Thank you for sharing. Please lay down in a comfortable position and let your mind drift away quietly.,"That is amazing, [Name]. Having a solid and peaceful night of rest shows your body is doing well."
Physical,Sleep,"Have you been facing a lot of trouble in falling asleep when you go to bed lately, [Name]?","A person getting cancer treatment said she felt sudden heat and sweating, which made it hard for her to sleep. She said, ""I wouldn’t get sleep due to hot flushes."" ","I hear you clearly. Not sleeping well makes the day feel tough, so please take a lot of rest today.",That is excellent news! Waking up with a calm and rested mind is a very big benefit for your health.
Physical,Sleep,"[Name], did a lack of sleep make you feel very exhausted and tired when the morning came?","A person getting cancer treatment said she felt sudden heat and sweating, which made it hard for her to sleep. She said, ""I wouldn’t get sleep due to hot flushes."" ",It is completely normal to feel slow after a sleepless night. Please listen to your body and rest now.,That brings a lot of joy. I am so happy that you enjoyed a very quiet and deep sleep last night.
Physical,Sleep,"Was it difficult for you to sleep through the night without waking up in the middle, [Name]?","A person getting cancer treatment said she felt sudden heat and sweating, which made it hard for her to sleep. She said, ""I wouldn’t get sleep due to hot flushes."" ","Thank you for telling me. When your night is disturbed, it is totally fine to sleep during the daytime.","That is fantastic, [Name]. Getting a full night of sound sleep gives so much strength to your body."
Physical,Fatigue,"[Name], do you feel weak or tired most of the day recently?","A person getting chemotherapy said she felt very tired for one week after treatment, told: ""The first two or three days (After chemotherapy) it was not that bad because they had given medications and all that then for one week extreme fatigue."" ",It is completely normal to feel weak right now. Please give your body the rest it is asking for today.,Having good energy is a great sign! That shows your body is finding its strength.
Physical,Fatigue,"When we are unwell, our energy can go low really fast. [Name], have you been feeling very weak, tired, or low on energy during the day?","A person getting chemotherapy said she felt very tired for one week after treatment, told: ""The first two or three days (After chemotherapy) it was not that bad because they had given medications and all that then for one week extreme fatigue."" ",It is completely normal to feel weak right now. Please give your body the rest it is asking for today.,Having good energy is a great sign! That shows your body is finding its strength.
Physical,Fatigue,"[Name], did you feel that even small movements or daily tasks are making you feel completely tired or drained this week?","A person getting chemotherapy said she felt very tired for one week after treatment, told: ""The first two or three days (After chemotherapy) it was not that bad because they had given medications and all that then for one week extreme fatigue."" ","Your body is working very hard on the inside to heal, so feeling tired is completely natural. Just relax and do not push yourself.","That is amazing, [Name]. It is so wonderful to see you moving around with a nice and active energy today."
Physical,Fatigue,"Sometimes the body just refuses to move because of weakness. [Name], has your body felt weak or tired most of the time lately?","A person getting chemotherapy said she felt very tired for one week after treatment, told: ""The first two or three days (After chemotherapy) it was not that bad because they had given medications and all that then for one week extreme fatigue."" ",Please do not feel guilty for staying in bed today. Listening to your tiredness and resting is exactly what your body needs right now.,I am very happy to hear that! Feeling fresh and active helps you enjoy your day so much more.
Physical,Fatigue,"[Name], in this past week, did you feel that you just don't have enough strength or power in your body to do your usual things?","A person getting chemotherapy said she felt very tired for one week after treatment, told: ""The first two or three days (After chemotherapy) it was not that bad because they had given medications and all that then for one week extreme fatigue."" ","Thank you for sharing this. It takes a lot of patience to deal with low energy, and you are doing great just by taking it day by day.",That is a very positive sign. It is wonderful that your body is feeling strong and full of life right now.
Physical,Fatigue,"[Name], do you feel that your body is not having strength and you are very tired during the daytime?","A person getting chemotherapy said she felt very tired for one week after treatment, told: ""The first two or three days (After chemotherapy) it was not that bad because they had given medications and all that then for one week extreme fatigue."" ",It is completely normal to feel weak right now. Please give your body the full rest it is asking for today.,Having good energy is a great sign! That shows your body is finding its strength.
Physical,Fatigue,"When we are unwell, our energy can go low really fast. [Name], have you been feeling very weak or tired recently?","A person getting chemotherapy said she felt very tired for one week after treatment, told: ""The first two or three days (After chemotherapy) it was not that bad because they had given medications and all that then for one week extreme fatigue."" ","Your body is working very hard on the inside to heal, so feeling tired is natural. Just relax today.","That is amazing, [Name]. It is so wonderful to see you moving around with active energy today."
Physical,Fatigue,"[Name], did you feel that even small movements or daily tasks are making you feel completely tired this week?","A person getting chemotherapy said she felt very tired for one week after treatment, told: ""The first two or three days (After chemotherapy) it was not that bad because they had given medications and all that then for one week extreme fatigue."" ",Please do not feel guilty for staying in bed today. Listening to your tiredness is what your body needs.,I am very happy to hear that! Feeling fresh and active helps you enjoy your day so much more.
Physical,Fatigue,"Sometimes the body just refuses to move because of weakness. [Name], has your body felt low on energy lately?","A person getting chemotherapy said she felt very tired for one week after treatment, told: ""The first two or three days (After chemotherapy) it was not that bad because they had given medications and all that then for one week extreme fatigue."" ","Thank you for sharing this. It takes a lot of patience to deal with low energy, so take it day by day.",That is a very positive sign. It is wonderful that your body is feeling strong and full of life right now.
Physical,Fatigue,"[Name], in this past week, did you feel that you just don't have enough strength or power in your body?","A person getting chemotherapy said she felt very tired for one week after treatment, told: ""The first two or three days (After chemotherapy) it was not that bad because they had given medications and all that then for one week extreme fatigue."" ","I understand completely, [Name]. When your energy battery is low, resting quietly is the smartest choice.",That is fantastic news! It is great to see you feeling so lively and full of energy today.
Physical,Fatigue,"Have you been feeling so tired that you want to lie down and sleep all through the day, [Name]?","A person getting chemotherapy said she felt very tired for one week after treatment, told: ""The first two or three days (After chemotherapy) it was not that bad because they had given medications and all that then for one week extreme fatigue."" ","Thank you for telling me. Your body needs extra rest to rebuild its power, so please sleep comfortably.",That brings a lot of relief. Having a steady and active strength during the day is wonderful.
Physical,Fatigue,"Have you been feeling completely drained out from morning to evening these past few days, [Name]?","A person getting chemotherapy said she felt very tired for one week after treatment, told: ""The first two or three days (After chemotherapy) it was not that bad because they had given medications and all that then for one week extreme fatigue."" ",It takes a lot of patience when your body feels weak. Please be very gentle with yourself and rest well.,That is fantastic! Hearing that you are feeling strong and full of life makes me very happy.
Physical,Fatigue,"[Name], did you find your body feeling totally tired even after resting for a long time this week?","A person getting chemotherapy said she felt very tired for one week after treatment, told: ""The first two or three days (After chemotherapy) it was not that bad because they had given medications and all that then for one week extreme fatigue."" ","I hear you, [Name]. Fatigue can be very tricky when you are unwell. Just take it one quiet hour at a time.",That is a very positive update. It is great that your body is finding its natural power again.
Physical,Fatigue,"Has your daily strength been very low, making your body feel weak, [Name]?","A person getting chemotherapy said she felt very tired for one week after treatment, told: ""The first two or three days (After chemotherapy) it was not that bad because they had given medications and all that then for one week extreme fatigue."" ","Please do not worry at all, [Name]. Your strength will return slowly. For today, just focus on resting well.","That brings a lot of joy. It is wonderful to see you feeling so light, active, and cheerful today."
Physical,Fatigue,"[Name], did you feel too tired or weak to do even the simple things this past week?","A person getting chemotherapy said she felt very tired for one week after treatment, told: ""The first two or three days (After chemotherapy) it was not that bad because they had given medications and all that then for one week extreme fatigue."" ","Thank you for being honest. Dealing with low energy is tough, but you are doing great just by resting.",That brings a big smile to my face. It is wonderful that your body feels so lively and energetic today.
Physical,Tobacco use,"To better understand your health, may I ask - do you currently use cigarettes, beedi, or any smokeless forms like gutka, paan, or chewing tobacco?","A person shared that when they feel upset or stressed, they may use gutka, pan, or chewing tobacco. They said, ""Usage of gutka, pan, and chewing tobacco.""",I appreciate your response. Please feel comfortable - your feelings are completely valid and respected.,"That's really wonderful to know, [Name]. I'm glad you're taking care of yourself and listening to your body."
Physical,Tobacco use,"To get a clear understanding of your health, [Name], do you currently smoke cigarettes, bidi, or use chewing items like gutka, khaini, or paan?","A person shared that when they feel upset or stressed, they may use gutka, pan, or chewing tobacco. They said, ""Usage of gutka, pan, and chewing tobacco.""",I appreciate your response. Please feel comfortable - your feelings are completely valid and respected.,"That's really wonderful to know, [Name]. I'm glad you're taking care of yourself and listening to your body."
Physical,Tobacco use,"[Name], may I ask if you have a habit of using tobacco in any form, like smoking cigarettes, beedi, or chewing packets from the shop?","A person shared that when they feel upset or stressed, they may use gutka, pan, or chewing tobacco. They said, ""Usage of gutka, pan, and chewing tobacco.""","Thank you for sharing this honestly with me. Your openness helps us understand your routine better, and your privacy is always fully respected.","That is excellent, [Name]. Keeping away from these habits is a wonderful way to protect your health and wellbeing."
Physical,Tobacco use,"Sometimes people use small habits to cope with daily stress. [Name], do you currently use any tobacco products, bidi, cigarettes, or paan masala?","A person shared that when they feel upset or stressed, they may use gutka, pan, or chewing tobacco. They said, ""Usage of gutka, pan, and chewing tobacco.""","I hear you clearly, [Name]. Thank you for speaking so openly with me today; your personal thoughts and answers are always respected here.",That is very good to hear. It is wonderful that you are keeping your body clean and focused on healthy habits.
