Category,Problem List Item,BraveEve's Conversational Question,Verbatim,Yes,No
Practical,Transportation,"[Name], was it very difficult or stressful for you to arrange a proper vehicle, bus, or auto to travel to the clinic for your appointments this week?","A person with cancer said it was hard to travel for treatment because she lived in a different town from the hospital. She said, ""For treatment, it was not easy to travel."" ","Traveling when you are unwell is definitely a big task. It is totally okay if it feels like a struggle right now. When you get to your clinic or back home, make sure you find a comfortable spot to sit down, sip some water, and give your body a good, long rest.",It's good to hear that travelling for your hospital visits has been manageable for you.
Practical,Transportation,"Have the bumpy roads, long traffic hours, or trouble booking a cab made your journey to the hospital feel completely tiring recently, [Name]?","A person with cancer said it was hard to travel for treatment because she lived in a different town from the hospital. She said, ""For treatment, it was not easy to travel."" ","Thank you for letting me know. Commuting in a weak body is an immense physical effort, so please do not rush yourself; take all the time you need to settle down comfortably.","That is a great thing to hear. Having a smooth, reliable, and comfortable way to reach your doctor saves so much of your vital energy."
Practical,Transportation,"[Name], did you face any trouble finding someone to drive you, or did the cost of daily travel to the health center feel too high this past week?","A person with cancer said it was hard to travel for treatment because she lived in a different town from the hospital. She said, ""For treatment, it was not easy to travel."" ","I understand completely, [Name]. Managing transit steps when your energy is low takes a lot of patience, so please make sure you rest deeply once you reach your room.",That brings a lot of relief. It is wonderful that your hospital trips are moving along smoothly without causing any extra strain on your body.
Practical,Transportation,"Has the lack of a comfortable vehicle made it difficult for you to reach your medical check-ups on time during these past few days, [Name]?","A person with cancer said it was hard to travel for treatment because she lived in a different town from the hospital. She said, ""For treatment, it was not easy to travel."" ","Thank you for being so honest. Traveling while recovering is a massive task, and it is entirely natural if you feel completely worn out by the commute today.","That is excellent, [Name]! Knowing that your travel arrangements are pleasant and easy is a wonderful highlight for your routine."
Practical,Transportation,"How about your transportation [Name], is it difficult for you to travel from your house to the hospital or clinic for your check-ups?","A person with cancer said it was hard to travel for treatment because she lived in a different town from the hospital. She said, ""For treatment, it was not easy to travel."" ","Thank you for telling me. Travel challenges can make clinic days feel double as hard, and you are being very brave just by making the trip.","That's really great, [Name]. It's good to know your travel route to the clinic is feeling completely smooth and easy right now."
Practical,Transportation,"[Name], was it very difficult or stressful for you to arrange a proper vehicle, bus, or auto to travel to the clinic for your appointments this week?","A person with cancer said it was hard to travel for treatment because she lived in a different town from the hospital. She said, ""For treatment, it was not easy to travel."" ",Thank you for sharing this honestly with me. Finding a reliable auto or vehicle when you are weak takes a lot of planning and heart.,"That is wonderful, [Name]! Having a comfortable vehicle ready at your doorstep is an excellent sign of a relaxed clinic day."
Practical,Transportation,"Have the bumpy roads, long traffic hours, or trouble booking a cab made your journey to the hospital feel completely tiring recently, [Name]?","A person with cancer said it was hard to travel for treatment because she lived in a different town from the hospital. She said, ""For treatment, it was not easy to travel."" ","I hear you clearly, [Name]. Bumpy streets and heavy traffic are highly exhausting for a healing body, so please take deep rest today.","That is very nice to hear. It is great that your road journey was smooth, quick, and free of any irritating traffic jams."
Practical,Transportation,"[Name], did you face any trouble finding someone to drive you, or did the cost of daily travel to the health center feel too high this past week?","A person with cancer said it was hard to travel for treatment because she lived in a different town from the hospital. She said, ""For treatment, it was not easy to travel."" ","Thank you for your honesty. Depending on others for a ride or facing high cab fares is tough, so please just rest easily now.","That is excellent, [Name]. I am so glad you have a dedicated driver or affordable travel means that keep your mind at total peace."
Practical,Transportation,"Has the lack of a comfortable vehicle made it difficult for you to reach your medical check-ups on time during these past few days, [Name]?","A person with cancer said it was hard to travel for treatment because she lived in a different town from the hospital. She said, ""For treatment, it was not easy to travel."" ","Thank you for being so honest with me, [Name]. Missing appointments due to transit limits is stressful, so please take a quiet break today.",That is a wonderful update! Reaching your doctor's room perfectly on time with full comfort is a great asset for your routine.
Practical,Transportation,"[Name], did a long wait for a public bus or train leave your legs feeling weak and painful before your check-up this week?","A person with cancer said it was hard to travel for treatment because she lived in a different town from the hospital. She said, ""For treatment, it was not easy to travel."" ","Thank you for sharing your heart so openly. Waiting at public transit stops drains your body's power, so please lie down and rest now.",That brings a lot of relief. It is fantastic that your transport links arrived exactly on time without causing any body strain.
Practical,Transportation,"[Name], did you find it difficult to walk from the hospital parking lot to the doctor's room because the distance was too long?","A person with cancer said it was hard to travel for treatment because she lived in a different town from the hospital. She said, ""For treatment, it was not easy to travel."" ",Thank you for being so open. Walking long hospital corridors takes a lot of physical power. Please ask for a wheelchair next time to rest.,"That is a very positive sign. It is wonderful that your clinic entry was short, direct, and completely comfortable for your feet."
Practical,Transportation,"[Name], did you feel nervous or scared while boarding a high bus step because your knees felt too stiff or weak this week?","A person with cancer said it was hard to travel for treatment because she lived in a different town from the hospital. She said, ""For treatment, it was not easy to travel."" ","Thank you for telling me. High steps can feel dangerous when your joints are tender due to medicines, so please take things very slow.","That is fantastic! Hearing that your transport vehicle was low-floor, accessible, and fully comfortable makes me very happy."
Practical,Transportation,"[Name], has it felt like a massive physical task to travel back home alone after an exhausting chemotherapy or clinic session?","A person with cancer said it was hard to travel for treatment because she lived in a different town from the hospital. She said, ""For treatment, it was not easy to travel."" ",Thank you for sharing this honestly. Returning home after a long clinical session is the hardest step; please give your body full time to sleep.,That is a perfect way to finish! I am so glad you had a loving family member sitting beside you to bring you back safely and softly.
Practical,Transportation,"Have you been feeling sad because your current health limits mean you can no longer drive your own scooter or car safely, [Name]?","A person with cancer said it was hard to travel for treatment because she lived in a different town from the hospital. She said, ""For treatment, it was not easy to travel."" ","I appreciate your honest words, [Name]. Losing your independent driving routine is a deep shift, and your feelings are fully respected here.","That brings a lot of joy. It is wonderful to see you enjoying the passenger seat with total comfort, ease, and a happy smile today."
Practical,Child care,"[Name], in this past week, did you find it very difficult or tiring to take care of your children's daily needs, like their food, school work, or looking after them?","A person with cancer said her daughter wanted her to go out, but her illness made it hard. She said, ""She would ask me, ‘Why are you not coming out?’"" ","Being a parent takes so much energy every single day. Please remember you are doing your best. Your children love you for being their mother, even if you are just resting on the bed right now.","That is really wonderful, [Name]! I am so glad you have the energy to look after your little ones and keep things going smoothly at home."
Practical,Child care,"[Name], did you find it very difficult or heavy to manage your children's daily food, school uniforms, or homework recently?","A person with cancer said her daughter wanted her to go out, but her illness made it hard. She said, ""She would ask me, ‘Why are you not coming out?’"" ","Being a parent takes so much energy every single day. Please remember you are doing your best. Your children love you for being their mother, even if you are just resting on the bed right now.","That is really wonderful, [Name]! I am so glad you have the energy to look after your little ones and keep things going smoothly at home."
Practical,Child care,"Have you been feeling completely tired or stressed by looking after your kids while dealing with your medical routine lately, [Name]?","A person with cancer said her daughter wanted her to go out, but her illness made it hard. She said, ""She would ask me, ‘Why are you not coming out?’"" ","Thank you for telling me your true feelings. Parenting requires a full battery, and it is completely okay if you cannot keep up with their busy schedules today. Just rest nicely.","That is fantastic, [Name]. Being able to look after your kids' daily needs with a bright smile is a beautiful proof of your inner strength."
Practical,Child care,"[Name], did your physical weakness make it a struggle for you to cook for your kids or check their school books during these past few days?","A person with cancer said her daughter wanted her to go out, but her illness made it hard. She said, ""She would ask me, ‘Why are you not coming out?’"" ","I hear you clearly, [Name]. Children are very understanding, and they love you just for being there with them. Please do not worry about skipping a few chores to rest your body.",That brings a big smile to my face. It is wonderful that your time with the children is going along beautifully without any physical exhaustion.
Practical,Child care,"Has it been a stressful task to look after your children's routines or play with them because your body was feeling too weak this week, [Name]?","A person with cancer said her daughter wanted her to go out, but her illness made it hard. She said, ""She would ask me, ‘Why are you not coming out?’"" ","Thank you for sharing this with me. Managing a family while healing takes an immense amount of heart, and it is entirely natural to take a step back and let yourself rest today.",I am very glad to know that! Keeping up with your children's daily world smoothly is a beautiful comfort during your recovery journey.
Practical,Child care,"[Name], in this past week, did you find it very difficult or tiring to take care of your children's daily needs, like their food, school work, or looking after them?","A person with cancer said her daughter wanted her to go out, but her illness made it hard. She said, ""She would ask me, ‘Why are you not coming out?’"" ","Thank you for sharing. It is difficult when you cannot manage your kids' needs easily due to health changes, and you are being very brave today.","That's really great, [Name]. It's good to know your routine with your children is feeling bright, stable, and joyful right now."
Practical,Child care,"[Name], did you find it very difficult or heavy to manage your children's daily food, school uniforms, or homework recently?","A person with cancer said her daughter wanted her to go out, but her illness made it hard. She said, ""She would ask me, ‘Why are you not coming out?’"" ","Thank you for sharing this honestly with me. Your openness helps us understand your routine, and your feelings are fully safe here.","That is wonderful, [Name]! Managing your children's daily uniforms and school tracks easily is an excellent sign of your inner power."
Practical,Child care,"Have you been feeling completely tired or stressed by looking after your kids while dealing with your medical routine lately, [Name]?","A person with cancer said her daughter wanted her to go out, but her illness made it hard. She said, ""She would ask me, ‘Why are you not coming out?’"" ","I hear you clearly, [Name]. Please do not carry any parental guilt today; your system is spending all its power to heal right now.",That is very nice to hear. It is great that you are matching your medical routine with your kids' schedules with total ease.
Practical,Child care,"[Name], did your physical weakness make it a struggle for you to cook for your kids or check their school books during these past few days?","A person with cancer said her daughter wanted her to go out, but her illness made it hard. She said, ""She would ask me, ‘Why are you not coming out?’"" ",Thank you for your honesty. There is absolutely no judgment here; taking a quiet rest while your kids read is completely fine today.,"That is excellent, [Name]. I am so glad your body felt comfortable enough to enjoy active evening studies with your kids."
Practical,Child care,"Has it been a stressful task to look after your children's routines or play with them because your body was feeling too weak this week, [Name]?","A person with cancer said her daughter wanted her to go out, but her illness made it hard. She said, ""She would ask me, ‘Why are you not coming out?’"" ","Thank you for being so honest with me, [Name]. It takes a lot of stamina to parent while being sick, so please just rest your body today.","That is a wonderful update! Having the active energy to laugh, chat, and play games with your kids brings a lot of peace to your house."
Practical,Child care,"[Name], did a sudden wave of fatigue make you miss waking up early to pack your children's school bags or snacks this week?","A person with cancer said her daughter wanted her to go out, but her illness made it hard. She said, ""She would ask me, ‘Why are you not coming out?’"" ","Thank you for telling me. When the body is healing, small schedule delays can happen. Please let your mind rest without any pressure.",That brings a lot of relief. It is fantastic that your morning steps with your children are staying completely smooth and cheerful.
Practical,Child care,"[Name], did you feel sad thinking that you are not able to take your children to the park or outside shops during these past few days?","A person with cancer said her daughter wanted her to go out, but her illness made it hard. She said, ""She would ask me, ‘Why are you not coming out?’"" ","Thank you for trusting me with this. Facing these small routine limits is tough, but your presence at home is what matters most to them.","That is superb, [Name]! Enjoying short, pleasant walks or comfortable outings with your children shows your strength is very good."
Practical,Child care,"[Name], did you find yourself speaking sharply or losing your patience with your children because your body was hurting too much?","A person with cancer said her daughter wanted her to go out, but her illness made it hard. She said, ""She would ask me, ‘Why are you not coming out?’"" ","Thank you for being so open. When your system is under medical stress, your patience can snap easily. Just breathe easy and rest now.","That is a very positive sign. It is wonderful that you are guiding your children with a calm, gentle, and relaxed mindset today."
Practical,Child care,"[Name], did you feel a wave of crying or sadness because you couldn't attend a parent-teacher meeting due to your medical check-up?","A person with cancer said her daughter wanted her to go out, but her illness made it hard. She said, ""She would ask me, ‘Why are you not coming out?’"" ","Thank you for telling me. Missing school events because of clinic timings is hard, but your only job right now is to heal your body.",That is fantastic! Hearing that your school visits or updates are moving forward beautifully makes me very happy.
Practical,Child care,"Have you felt that managing child care alongside your current medicines is becoming too heavy a task to handle on your own, [Name]?","A person with cancer said her daughter wanted her to go out, but her illness made it hard. She said, ""She would ask me, ‘Why are you not coming out?’"" ","I appreciate your honest words, [Name]. Juggling parental tasks with a medical routine is tough, and your response is fully respected here.","That brings a lot of joy. It is wonderful to see you enjoying your beautiful role as a parent with total comfort, ease, and a smile."
Practical,Having enough food,Let us talk about your food. Did you face any trouble having enough food or getting groceries for your daily cooking?,"A person with cancer said her brother borrowed money to help her get food for the house. She said, ""My brother would borrow money and help me get food items for the house."" ","You've shared something important. Please remember to take things one day at a time, and don't hesitate to let your neighbours or family help you with cooking right now.",I am very glad to know that you are getting your daily meals properly and don't have to worry about food right now.
Practical,Having enough food,"[Name], did you face any trouble or shortage in getting fresh groceries from the market or having proper, cooked meals for your daily diet this week?","A person with cancer said her brother borrowed money to help her get food for the house. She said, ""My brother would borrow money and help me get food items for the house."" ","You've shared something important. Please remember to take things one day at a time, and don't hesitate to let your neighbours or family help you with cooking right now.",I am very glad to know that you are getting your daily meals properly and don't have to worry about food right now.
Practical,Having enough food,"Has it been difficult for you to stand in the kitchen and prepare nutritious food because your body feels too tired or weak lately, [Name]?","A person with cancer said her brother borrowed money to help her get food for the house. She said, ""My brother would borrow money and help me get food items for the house."" ","Thank you for being so honest with me. When your energy is low, cooking a full meal can feel like a massive chore. Please feel completely free to eat something light and simple today.","That is excellent to hear, [Name]. Getting your daily nutrition easily and enjoying your home-cooked meals is the best fuel for your recovery."
Practical,Having enough food,"[Name], did a lack of supplies or not having anyone to go to the shop make it hard for you to get your regular meals during these past few days?","A person with cancer said her brother borrowed money to help her get food for the house. She said, ""My brother would borrow money and help me get food items for the house."" ","I understand your situation, [Name]. Managing food when times are tough is a significant task, so please just take it one small bite at a time and rest your body completely.","That brings a lot of relief. Knowing that your kitchen is well-stocked and you are getting fresh, timely food brings great peace of mind."
Practical,Having enough food,"Have you been skipping meals or eating simple snacks because arranging proper, cooked grocery items felt too stressful this week, [Name]?","A person with cancer said her brother borrowed money to help her get food for the house. She said, ""My brother would borrow money and help me get food items for the house."" ","Thank you for sharing this with me. Your physical comfort is the most important thing right now, so please do not take any pressure and just focus on relaxing your body today.",That is wonderful news! It is great to know that your daily food routine is steady and causing absolutely zero worry for you.
Practical,Having enough food,"Let us talk about your food. Did you face any trouble having enough food or getting groceries for your daily cooking, [Name]?","A person with cancer said her brother borrowed money to help her get food for the house. She said, ""My brother would borrow money and help me get food items for the house."" ","Thank you for telling me. Having trouble with daily groceries is hard when you are unwell, and you are being very brave by sharing it.","That's really great, [Name]. It's good to know your kitchen supplies and daily cooking are going forward perfectly right now."
Practical,Having enough food,"[Name], did you face any trouble or shortage in getting fresh groceries from the market or having proper, cooked meals for your daily diet this week?","A person with cancer said her brother borrowed money to help her get food for the house. She said, ""My brother would borrow money and help me get food items for the house."" ","Thank you for sharing this honestly with me. Getting fresh food from the market takes energy, and your privacy is fully secure here.","That is wonderful, [Name]! Having proper, warm, and freshly cooked meals every day is an excellent sign of a healthy routine."
Practical,Having enough food,"Has it been difficult for you to stand in the kitchen and prepare nutritious food because your body feels too tired or weak lately, [Name]?","A person with cancer said her brother borrowed money to help her get food for the house. She said, ""My brother would borrow money and help me get food items for the house."" ","I hear you clearly, [Name]. Standing near a hot stove when your body is weak is highly exhausting, so please let someone else cook today.",That is very nice to hear. It is great that your body feels light and active enough to handle your daily kitchen tasks with total ease.
Practical,Having enough food,"[Name], did a lack of supplies or not having anyone to go to the shop make it hard for you to get your regular meals during these past few days?","A person with cancer said her brother borrowed money to help her get food for the house. She said, ""My brother would borrow money and help me get food items for the house."" ","Thank you for your honesty. There is absolutely no judgment here; waiting for grocery help can be tough, so please rest easy today.","That is excellent, [Name]. I am so glad you have a dedicated support line or family member to fetch your market supplies instantly."
Practical,Having enough food,"Have you been skipping meals or eating simple snacks because arranging proper, cooked grocery items felt too stressful this week, [Name]?","A person with cancer said her brother borrowed money to help her get food for the house. She said, ""My brother would borrow money and help me get food items for the house."" ","Thank you for being so honest with me, [Name]. Skipping meals can lower your strength, so please try to take a simple warm soup and rest.",That is a wonderful update! Eating your full nutritious meals on time without any household stress is a great asset for your recovery.
Practical,Having enough food,"[Name], did you feel a loss of appetite or a change in taste that made it hard to finish your regular plate of food this week?","A person with cancer said her brother borrowed money to help her get food for the house. She said, ""My brother would borrow money and help me get food items for the house."" ","Thank you for sharing your heart openly. Medicine updates can alter your taste easily, so please eat small bites and take complete rest.",That brings a lot of relief. It is fantastic that your food tastes fresh and you are enjoying your daily meals with an easy heart.
Practical,Having enough food,"[Name], did you find yourself eating old or cold leftovers because you lacked the physical power to reheat your food safely?","A person with cancer said her brother borrowed money to help her get food for the house. She said, ""My brother would borrow money and help me get food items for the house."" ",Thank you for trusting me with this. Handling heavy utensils when your limbs are tired is difficult. Please ask a loved one to help you out.,"That is superb, [Name]! Enjoying hot, freshly served meals throughout the daytime is a beautiful thing for your health and comfort."
